{"adjacencies":[{"boundaries":[{"closed":true,"dihedral_deg":0.0,"end_vertex":null,"kind":"tangent","points":[[8.5,0.0,4.0],[8.33667488342746,1.6582677371370902,4.0],[7.852976026345937,3.252809175103263,4.0],[7.067491704571634,4.722346980666618,4.0],[6.0104076400856545,6.010407640085654,4.0],[4.72234698066662,7.067491704571634,4.0],[3.2528091751032635,7.852976026345937,4.0],[1.6582677371370909,8.33667488342746,4.0],[5.204748896376251e-16,8.5,4.0],[-1.6582677371370895,8.33667488342746,4.0],[-3.2528091751032626,7.852976026345937,4.0],[-4.722346980666616,7.067491704571635,4.0],[-6.010407640085654,6.0104076400856545,4.0],[-7.067491704571635,4.722346980666618,4.0],[-7.852976026345937,3.252809175103264,4.0],[-8.33667488342746,1.658267737137093,4.0],[-8.5,1.0409497792752501e-15,4.0],[-8.33667488342746,-1.658267737137091,4.0],[-7.852976026345938,-3.252809175103262,4.0],[-7.067491704571636,-4.722346980666616,4.0],[-6.010407640085655,-6.010407640085654,4.0],[-4.722346980666618,-7.067491704571634,4.0],[-3.252809175103268,-7.852976026345935,4.0],[-1.6582677371370937,-8.336674883427458,4.0],[-1.5614246689128753e-15,-8.5,4.0],[1.6582677371370906,-8.33667488342746,4.0],[3.252809175103265,-7.852976026345936,4.0],[4.722346980666615,-7.067491704571636,4.0],[6.010407640085653,-6.010407640085655,4.0],[7.067491704571634,-4.722346980666618,4.0],[7.852976026345935,-3.2528091751032684,4.0],[8.336674883427458,-1.6582677371370942,4.0]],"start_vertex":null}],"regions":[0,3]},{"boundaries":[{"closed":true,"dihedral_deg":90.0,"end_vertex":null,"kind":"transversal","points":[[9.807852804032303,-1.9509032201612873,0.0],[9.238795325112864,-3.826834323650904,0.0],[8.314696123025453,-5.555702330196022,0.0],[7.071067811865474,-7.071067811865477,0.0],[5.555702330196018,-8.314696123025454,0.0],[3.8268343236509,-9.238795325112866,0.0],[1.950903220161283,-9.807852804032304,0.0],[-1.8369701987210296e-15,-10.0,0.0],[-1.9509032201612866,-9.807852804032303,0.0],[-3.8268343236509033,-9.238795325112864,0.0],[-5.555702330196022,-8.314696123025453,0.0],[-7.071067811865477,-7.071067811865475,0.0],[-8.314696123025454,-5.55570233019602,0.0],[-9.238795325112868,-3.8268343236508966,0.0],[-9.807852804032304,-1.9509032201612837,0.0],[-10.0,1.2246467991473533e-15,0.0],[-9.807852804032304,1.9509032201612861,0.0],[-9.238795325112868,3.826834323650899,0.0],[-8.314696123025453,5.555702330196022,0.0],[-7.071067811865475,7.0710678118654755,0.0],[-5.55570233019602,8.314696123025453,0.0],[-3.826834323650897,9.238795325112868,0.0],[-1.950903220161282,9.807852804032304,0.0],[6.123233995736766e-16,10.0,0.0],[1.9509032201612833,9.807852804032304,0.0],[3.8268343236508984,9.238795325112868,0.0],[5.555702330196023,8.314696123025453,0.0],[7.0710678118654755,7.071067811865475,0.0],[8.314696123025453,5.555702330196022,0.0],[9.238795325112868,3.826834323650898,0.0],[9.807852804032304,1.9509032201612824,0.0],[10.0,0.0,0.0]],"start_vertex":null}],"regions":[1,2]},{"boundaries":[{"closed":true,"dihedral_deg":0.0,"end_vertex":null,"kind":"tangent","points":[[9.807852804032303,-1.9509032201612873,2.5],[9.238795325112864,-3.826834323650904,2.5],[8.314696123025453,-5.555702330196022,2.5],[7.071067811865474,-7.071067811865477,2.5],[5.555702330196018,-8.314696123025454,2.5],[3.8268343236509,-9.238795325112866,2.5],[1.950903220161283,-9.807852804032304,2.5],[-1.8369701987210296e-15,-10.0,2.5],[-1.9509032201612866,-9.807852804032303,2.5],[-3.8268343236509033,-9.238795325112864,2.5],[-5.555702330196022,-8.314696123025453,2.5],[-7.071067811865477,-7.071067811865475,2.5],[-8.314696123025454,-5.55570233019602,2.5],[-9.238795325112868,-3.8268343236508966,2.5],[-9.807852804032304,-1.9509032201612837,2.5],[-10.0,1.2246467991473533e-15,2.5],[-9.807852804032304,1.9509032201612861,2.5],[-9.238795325112868,3.826834323650899,2.5],[-8.314696123025453,5.555702330196022,2.5],[-7.071067811865475,7.0710678118654755,2.5],[-5.55570233019602,8.314696123025453,2.5],[-3.826834323650897,9.238795325112868,2.5],[-1.950903220161282,9.807852804032304,2.5],[6.123233995736766e-16,10.0,2.5],[1.9509032201612833,9.807852804032304,2.5],[3.8268343236508984,9.238795325112868,2.5],[5.555702330196023,8.314696123025453,2.5],[7.0710678118654755,7.071067811865475,2.5],[8.314696123025453,5.555702330196022,2.5],[9.238795325112868,3.826834323650898,2.5],[9.807852804032304,1.9509032201612824,2.5],[10.0,0.0,2.5]],"start_vertex":null}],"regions":[2,3]}],"ir_version":0,"regions":[{"id":0,"residual":{"max":0.00006,"rms":0.00002},"surface":{"normal":[0.0,0.0,1.0],"origin":[0.0,0.0,4.0],"type":"plane"},"triangles":[0,1]},{"id":1,"residual":{"max":0.00006,"rms":0.00002},"surface":{"normal":[0.0,0.0,-1.0],"origin":[0.0,0.0,0.0],"type":"plane"},"triangles":[2,3]},{"id":2,"residual":{"max":0.00006,"rms":0.00002},"surface":{"axis":[0.0,0.0,1.0],"orientation":"same","origin":[0.0,0.0,0.0],"radius":10.0,"type":"cylinder"},"triangles":[4,5,6,7,8,9,10,11,12,13,14,15,16,17,18,19,20,21,22,23,24,25,26,27,28,29,30,31,32,33,34,35]},{"id":3,"residual":{"max":0.00006,"rms":0.00002},"surface":{"axis":[0.0,0.0,1.0],"center":[0.0,0.0,2.5],"major_radius":8.5,"minor_radius":1.5,"orientation":"same","type":"torus"},"triangles":[36,37,38,39,40,41,42,43,44,45,46,47,48,49,50,51,52,53,54,55,56,57,58,59,60,61,62,63,64,65,66,67]}],"shells":[{"closed":true,"parent":null,"regions":[0,1,2,3],"role":"outer"}],"source":{"triangle_count":68,"vertex_count":36},"tolerances":{"angular_snap_deg":0.5,"linear":0.001,"tangent_threshold_deg":3.0,"vertex_merge":1e-6},"vertices":[]}
