{"adjacencies":[{"boundaries":[{"closed":true,"dihedral_deg":90.0,"end_vertex":null,"kind":"transversal","points":[[12.942355841209691,4.414729033951614,0.0],[12.77163859753386,3.851949702904729,0.0],[12.494408836907635,3.3332893009411935,0.0],[12.121320343559642,2.878679656440357,0.0],[11.666710699058806,2.5055911630923635,0.0],[11.14805029709527,2.22836140246614,0.0],[10.585270966048386,2.0576441587903087,0.0],[10.0,2.0,0.0],[9.414729033951614,2.057644158790309,0.0],[8.85194970290473,2.2283614024661405,0.0],[8.333289300941193,2.5055911630923644,0.0],[7.878679656440357,2.8786796564403576,0.0],[7.5055911630923635,3.3332893009411944,0.0],[7.22836140246614,3.851949702904731,0.0],[7.057644158790309,4.414729033951615,0.0],[7.0,5.0,0.0],[7.057644158790309,5.585270966048386,0.0],[7.22836140246614,6.14805029709527,0.0],[7.5055911630923635,6.6667106990588065,0.0],[7.878679656440358,7.121320343559643,0.0],[8.333289300941194,7.4944088369076365,0.0],[8.851949702904731,7.77163859753386,0.0],[9.414729033951616,7.942355841209691,0.0],[10.0,8.0,0.0],[10.585270966048386,7.942355841209691,0.0],[11.148050297095269,7.77163859753386,0.0],[11.666710699058807,7.494408836907636,0.0],[12.121320343559642,7.121320343559642,0.0],[12.494408836907635,6.6667106990588065,0.0],[12.77163859753386,6.148050297095269,0.0],[12.942355841209691,5.585270966048385,0.0],[13.0,5.0,0.0]],"start_vertex":null}],"regions":[0,1]},{"boundaries":[{"closed":false,"dihedral_deg":64.179634,"end_vertex":0,"kind":"tangent","points":[[11.552914270615124,7.566799031502056,5.1034245278319466],[11.868658615822799,7.346937361224459,4.921129445131194],[12.153666922446089,7.088472836108145,4.756579822580958],[12.403251321745854,6.795656727920681,4.612482202459708],[12.613306603887628,6.473305329548941,4.491206728770452],[12.780377741183585,6.126720735733069,4.394748162678814],[12.901716717019674,5.761603633242751,4.324693072316654],[12.975327725735355,5.383959534938889,4.2821937366193366],[13.0,5.0,4.267949192431123],[12.975327725735355,4.616040465061112,4.2821937366193366],[12.901716717019674,4.238396366757249,4.324693072316654],[12.780377741183585,3.873279264266931,4.394748162678814],[12.613306603887628,3.526694670451059,4.491206728770452],[12.403251321745854,3.204343272079319,4.612482202459708],[12.153666922446089,2.911527163891855,4.756579822580958],[11.868658615822797,2.653062638775541,4.921129445131195],[11.552914270615124,2.433200968497944,5.1034245278319466]],"start_vertex":1},{"closed":false,"dihedral_deg":104.214392,"end_vertex":1,"kind":"transversal","points":[[11.552914270615124,2.433200968497944,5.1034245278319466],[11.201074935203554,2.2509239734001936,5.306559062843316],[10.828281403470312,2.116607914857008,5.5217915087416545],[10.441037506793801,2.0325960980006266,5.745366876729878],[10.046099180542821,2.0003542099852387,5.973384625704181],[9.650356598661283,2.0204447493123587,6.201866711883285],[9.260713966299537,2.0925172123681564,6.426826990565093],[8.883969067654466,2.2153142083804216,6.644340759213643],[8.52669467045106,2.3866933961123715,6.85061322861359],[8.195123856106871,2.603664859581309,7.042045727530631],[7.895041276132531,2.8624432707377716,7.215298485857934],[7.6316822319311335,3.1585139290645436,7.367348900921133],[7.40964133867076,3.4867115259552834,7.495544270416115],[7.23279236669866,3.841310259733523,7.597648071990116],[7.104220658960034,4.21612372914717,7.671878982063181],[7.026169303480787,4.604612862576371,7.71694195315974],[7.0,5.0,7.732050807568877],[7.026169303480787,5.3953871374236275,7.71694195315974],[7.104220658960035,5.783876270852831,7.6718789820631805],[7.23279236669866,6.158689740266476,7.597648071990116],[7.40964133867076,6.5132884740447174,7.495544270416115],[7.6316822319311335,6.841486070935456,7.367348900921133],[7.895041276132529,7.1375567292622275,7.215298485857935],[8.195123856106871,7.3963351404186914,7.042045727530631],[8.526694670451059,7.613306603887628,6.850613228613591],[8.883969067654466,7.784685791619578,6.644340759213643],[9.260713966299535,7.907482787631844,6.426826990565094],[9.650356598661283,7.979555250687641,6.201866711883285],[10.046099180542821,7.999645790014761,5.973384625704181],[10.441037506793798,7.967403901999374,5.74536687672988],[10.828281403470312,7.883392085142992,5.5217915087416545],[11.201074935203554,7.7490760265998055,5.306559062843316],[11.552914270615124,7.566799031502056,5.1034245278319466]],"start_vertex":0}],"regions":[1,2]}],"ir_version":0,"regions":[{"id":0,"residual":{"max":0.00006,"rms":0.00002},"surface":{"normal":[0.0,0.0,-1.0],"origin":[10.0,5.0,0.0],"type":"plane"},"triangles":[0,1]},{"id":1,"residual":{"max":0.00006,"rms":0.00002},"surface":{"axis":[0.0,0.0,1.0],"orientation":"same","origin":[10.0,5.0,0.0],"radius":3.0,"type":"cylinder"},"triangles":[2,3,4,5,6,7,8,9,10,11,12,13,14,15,16,17]},{"id":2,"residual":{"max":0.00006,"rms":0.00002},"surface":{"normal":[0.49999999999999994,0.0,0.8660254037844387],"origin":[10.0,5.0,6.0],"type":"plane"},"triangles":[18,19,20,21]}],"shells":[{"closed":true,"parent":null,"regions":[0,1,2],"role":"outer"}],"source":{"triangle_count":22,"vertex_count":13},"tolerances":{"angular_snap_deg":0.5,"linear":0.001,"tangent_threshold_deg":75.0,"vertex_merge":1e-6},"vertices":[{"id":0,"position":[11.552914271,2.433200968,5.103424528],"regions":[1,2],"role":"kind_change","source_positions":[[11.552914271,2.433200968,5.103424528]]},{"id":1,"position":[11.552914271,7.566799032,5.103424528],"regions":[1,2],"role":"kind_change","source_positions":[[11.552914271,7.566799032,5.103424528]]}]}
