{"adjacencies":[{"boundaries":[{"closed":false,"dihedral_deg":90.0,"end_vertex":1,"kind":"transversal","points":[[0.0,0.0,0.0],[0.0,0.0,20.0]],"start_vertex":0}],"regions":[0,2]},{"boundaries":[{"closed":false,"dihedral_deg":90.0,"end_vertex":2,"kind":"transversal","points":[[0.0,20.0,20.0],[0.0,20.0,0.0]],"start_vertex":3}],"regions":[0,3]},{"boundaries":[{"closed":false,"dihedral_deg":90.0,"end_vertex":0,"kind":"transversal","points":[[0.0,20.0,0.0],[0.0,0.0,0.0]],"start_vertex":2}],"regions":[0,4]},{"boundaries":[{"closed":false,"dihedral_deg":90.0,"end_vertex":3,"kind":"transversal","points":[[0.0,0.0,20.0],[0.0,20.0,20.0]],"start_vertex":1}],"regions":[0,5]},{"boundaries":[{"closed":false,"dihedral_deg":90.0,"end_vertex":12,"kind":"transversal","points":[[20.0,0.0,20.0],[20.0,0.0,0.0]],"start_vertex":13}],"regions":[1,2]},{"boundaries":[{"closed":false,"dihedral_deg":90.0,"end_vertex":15,"kind":"transversal","points":[[20.0,20.0,0.0],[20.0,20.0,20.0]],"start_vertex":14}],"regions":[1,3]},{"boundaries":[{"closed":false,"dihedral_deg":90.0,"end_vertex":14,"kind":"transversal","points":[[20.0,0.0,0.0],[20.0,20.0,0.0]],"start_vertex":12}],"regions":[1,4]},{"boundaries":[{"closed":false,"dihedral_deg":90.0,"end_vertex":13,"kind":"transversal","points":[[20.0,20.0,20.0],[20.0,0.0,20.0]],"start_vertex":15}],"regions":[1,5]},{"boundaries":[{"closed":false,"dihedral_deg":90.0,"end_vertex":12,"kind":"transversal","points":[[0.0,0.0,0.0],[20.0,0.0,0.0]],"start_vertex":0}],"regions":[2,4]},{"boundaries":[{"closed":false,"dihedral_deg":90.0,"end_vertex":1,"kind":"transversal","points":[[20.0,0.0,20.0],[0.0,0.0,20.0]],"start_vertex":13}],"regions":[2,5]},{"boundaries":[{"closed":false,"dihedral_deg":90.0,"end_vertex":2,"kind":"transversal","points":[[20.0,20.0,0.0],[0.0,20.0,0.0]],"start_vertex":14}],"regions":[3,4]},{"boundaries":[{"closed":false,"dihedral_deg":90.0,"end_vertex":15,"kind":"transversal","points":[[0.0,20.0,20.0],[20.0,20.0,20.0]],"start_vertex":3}],"regions":[3,5]},{"boundaries":[{"closed":false,"dihedral_deg":90.0,"end_vertex":4,"kind":"transversal","points":[[7.0,7.0,13.0],[7.0,7.0,7.0]],"start_vertex":5}],"regions":[6,8]},{"boundaries":[{"closed":false,"dihedral_deg":90.0,"end_vertex":7,"kind":"transversal","points":[[7.0,13.0,7.0],[7.0,13.0,13.0]],"start_vertex":6}],"regions":[6,9]},{"boundaries":[{"closed":false,"dihedral_deg":90.0,"end_vertex":6,"kind":"transversal","points":[[7.0,7.0,7.0],[7.0,13.0,7.0]],"start_vertex":4}],"regions":[6,10]},{"boundaries":[{"closed":false,"dihedral_deg":90.0,"end_vertex":5,"kind":"transversal","points":[[7.0,13.0,13.0],[7.0,7.0,13.0]],"start_vertex":7}],"regions":[6,11]},{"boundaries":[{"closed":false,"dihedral_deg":90.0,"end_vertex":9,"kind":"transversal","points":[[13.0,7.0,7.0],[13.0,7.0,13.0]],"start_vertex":8}],"regions":[7,8]},{"boundaries":[{"closed":false,"dihedral_deg":90.0,"end_vertex":10,"kind":"transversal","points":[[13.0,13.0,13.0],[13.0,13.0,7.0]],"start_vertex":11}],"regions":[7,9]},{"boundaries":[{"closed":false,"dihedral_deg":90.0,"end_vertex":8,"kind":"transversal","points":[[13.0,13.0,7.0],[13.0,7.0,7.0]],"start_vertex":10}],"regions":[7,10]},{"boundaries":[{"closed":false,"dihedral_deg":90.0,"end_vertex":11,"kind":"transversal","points":[[13.0,7.0,13.0],[13.0,13.0,13.0]],"start_vertex":9}],"regions":[7,11]},{"boundaries":[{"closed":false,"dihedral_deg":90.0,"end_vertex":4,"kind":"transversal","points":[[13.0,7.0,7.0],[7.0,7.0,7.0]],"start_vertex":8}],"regions":[8,10]},{"boundaries":[{"closed":false,"dihedral_deg":90.0,"end_vertex":9,"kind":"transversal","points":[[7.0,7.0,13.0],[13.0,7.0,13.0]],"start_vertex":5}],"regions":[8,11]},{"boundaries":[{"closed":false,"dihedral_deg":90.0,"end_vertex":10,"kind":"transversal","points":[[7.0,13.0,7.0],[13.0,13.0,7.0]],"start_vertex":6}],"regions":[9,10]},{"boundaries":[{"closed":false,"dihedral_deg":90.0,"end_vertex":7,"kind":"transversal","points":[[13.0,13.0,13.0],[7.0,13.0,13.0]],"start_vertex":11}],"regions":[9,11]}],"ir_version":0,"regions":[{"id":0,"residual":{"max":0.00006,"rms":0.00002},"surface":{"normal":[-1.0,0.0,0.0],"origin":[0.0,0.0,0.0],"type":"plane"},"triangles":[0,1]},{"id":1,"residual":{"max":0.00006,"rms":0.00002},"surface":{"normal":[1.0,0.0,0.0],"origin":[20.0,0.0,0.0],"type":"plane"},"triangles":[2,3]},{"id":2,"residual":{"max":0.00006,"rms":0.00002},"surface":{"normal":[0.0,-1.0,0.0],"origin":[0.0,0.0,0.0],"type":"plane"},"triangles":[4,5]},{"id":3,"residual":{"max":0.00006,"rms":0.00002},"surface":{"normal":[0.0,1.0,0.0],"origin":[0.0,20.0,0.0],"type":"plane"},"triangles":[6,7]},{"id":4,"residual":{"max":0.00006,"rms":0.00002},"surface":{"normal":[0.0,0.0,-1.0],"origin":[0.0,0.0,0.0],"type":"plane"},"triangles":[8,9]},{"id":5,"residual":{"max":0.00006,"rms":0.00002},"surface":{"normal":[0.0,0.0,1.0],"origin":[0.0,0.0,20.0],"type":"plane"},"triangles":[10,11]},{"id":6,"residual":{"max":0.00006,"rms":0.00002},"surface":{"normal":[1.0,0.0,0.0],"origin":[7.0,7.0,7.0],"type":"plane"},"triangles":[12,13]},{"id":7,"residual":{"max":0.00006,"rms":0.00002},"surface":{"normal":[-1.0,0.0,0.0],"origin":[13.0,7.0,7.0],"type":"plane"},"triangles":[14,15]},{"id":8,"residual":{"max":0.00006,"rms":0.00002},"surface":{"normal":[0.0,1.0,0.0],"origin":[7.0,7.0,7.0],"type":"plane"},"triangles":[16,17]},{"id":9,"residual":{"max":0.00006,"rms":0.00002},"surface":{"normal":[0.0,-1.0,0.0],"origin":[7.0,13.0,7.0],"type":"plane"},"triangles":[18,19]},{"id":10,"residual":{"max":0.00006,"rms":0.00002},"surface":{"normal":[0.0,0.0,1.0],"origin":[7.0,7.0,7.0],"type":"plane"},"triangles":[20,21]},{"id":11,"residual":{"max":0.00006,"rms":0.00002},"surface":{"normal":[0.0,0.0,-1.0],"origin":[7.0,7.0,13.0],"type":"plane"},"triangles":[22,23]}],"shells":[{"closed":true,"parent":null,"regions":[0,1,2,3,4,5],"role":"outer"},{"closed":true,"parent":0,"regions":[6,7,8,9,10,11],"role":"cavity"}],"source":{"triangle_count":24,"vertex_count":14},"tolerances":{"angular_snap_deg":0.5,"linear":0.001,"tangent_threshold_deg":3.0,"vertex_merge":1e-6},"vertices":[{"id":0,"position":[0.0,0.0,0.0],"regions":[0,2,4],"role":"junction","source_positions":[[0.0,0.0,0.0]]},{"id":1,"position":[0.0,0.0,20.0],"regions":[0,2,5],"role":"junction","source_positions":[[0.0,0.0,20.0]]},{"id":2,"position":[0.0,20.0,0.0],"regions":[0,3,4],"role":"junction","source_positions":[[0.0,20.0,0.0]]},{"id":3,"position":[0.0,20.0,20.0],"regions":[0,3,5],"role":"junction","source_positions":[[0.0,20.0,20.0]]},{"id":4,"position":[7.0,7.0,7.0],"regions":[6,8,10],"role":"junction","source_positions":[[7.0,7.0,7.0]]},{"id":5,"position":[7.0,7.0,13.0],"regions":[6,8,11],"role":"junction","source_positions":[[7.0,7.0,13.0]]},{"id":6,"position":[7.0,13.0,7.0],"regions":[6,9,10],"role":"junction","source_positions":[[7.0,13.0,7.0]]},{"id":7,"position":[7.0,13.0,13.0],"regions":[6,9,11],"role":"junction","source_positions":[[7.0,13.0,13.0]]},{"id":8,"position":[13.0,7.0,7.0],"regions":[7,8,10],"role":"junction","source_positions":[[13.0,7.0,7.0]]},{"id":9,"position":[13.0,7.0,13.0],"regions":[7,8,11],"role":"junction","source_positions":[[13.0,7.0,13.0]]},{"id":10,"position":[13.0,13.0,7.0],"regions":[7,9,10],"role":"junction","source_positions":[[13.0,13.0,7.0]]},{"id":11,"position":[13.0,13.0,13.0],"regions":[7,9,11],"role":"junction","source_positions":[[13.0,13.0,13.0]]},{"id":12,"position":[20.0,0.0,0.0],"regions":[1,2,4],"role":"junction","source_positions":[[20.0,0.0,0.0]]},{"id":13,"position":[20.0,0.0,20.0],"regions":[1,2,5],"role":"junction","source_positions":[[20.0,0.0,20.0]]},{"id":14,"position":[20.0,20.0,0.0],"regions":[1,3,4],"role":"junction","source_positions":[[20.0,20.0,0.0]]},{"id":15,"position":[20.0,20.0,20.0],"regions":[1,3,5],"role":"junction","source_positions":[[20.0,20.0,20.0]]}]}
