{"adjacencies":[{"boundaries":[{"closed":false,"dihedral_deg":90.0,"end_vertex":1,"kind":"transversal","points":[[0.0,0.0,0.0],[0.0,0.0,8.0]],"start_vertex":0}],"regions":[0,2]},{"boundaries":[{"closed":false,"dihedral_deg":90.0,"end_vertex":2,"kind":"transversal","points":[[0.0,20.0,8.0],[0.0,20.0,0.0]],"start_vertex":3}],"regions":[0,3]},{"boundaries":[{"closed":false,"dihedral_deg":90.0,"end_vertex":0,"kind":"transversal","points":[[0.0,20.0,0.0],[0.0,0.0,0.0]],"start_vertex":2}],"regions":[0,4]},{"boundaries":[{"closed":false,"dihedral_deg":90.0,"end_vertex":3,"kind":"transversal","points":[[0.0,0.0,8.0],[0.0,20.0,8.0]],"start_vertex":1}],"regions":[0,5]},{"boundaries":[{"closed":false,"dihedral_deg":90.0,"end_vertex":4,"kind":"transversal","points":[[20.0,0.0,8.0],[20.0,0.0,0.0]],"start_vertex":5}],"regions":[1,2]},{"boundaries":[{"closed":false,"dihedral_deg":90.0,"end_vertex":7,"kind":"transversal","points":[[20.0,20.0,0.0],[20.0,20.0,8.0]],"start_vertex":6}],"regions":[1,3]},{"boundaries":[{"closed":false,"dihedral_deg":90.0,"end_vertex":6,"kind":"transversal","points":[[20.0,0.0,0.0],[20.0,20.0,0.0]],"start_vertex":4}],"regions":[1,4]},{"boundaries":[{"closed":false,"dihedral_deg":90.0,"end_vertex":5,"kind":"transversal","points":[[20.0,20.0,8.0],[20.0,0.0,8.0]],"start_vertex":7}],"regions":[1,5]},{"boundaries":[{"closed":false,"dihedral_deg":90.0,"end_vertex":4,"kind":"transversal","points":[[0.0,0.0,0.0],[20.0,0.0,0.0]],"start_vertex":0}],"regions":[2,4]},{"boundaries":[{"closed":false,"dihedral_deg":90.0,"end_vertex":1,"kind":"transversal","points":[[20.0,0.0,8.0],[0.0,0.0,8.0]],"start_vertex":5}],"regions":[2,5]},{"boundaries":[{"closed":false,"dihedral_deg":90.0,"end_vertex":2,"kind":"transversal","points":[[20.0,20.0,0.0],[0.0,20.0,0.0]],"start_vertex":6}],"regions":[3,4]},{"boundaries":[{"closed":false,"dihedral_deg":90.0,"end_vertex":7,"kind":"transversal","points":[[0.0,20.0,8.0],[20.0,20.0,8.0]],"start_vertex":3}],"regions":[3,5]},{"boundaries":[{"closed":true,"dihedral_deg":90.0,"end_vertex":null,"kind":"transversal","points":[[12.0,10.0,0.0],[11.96157056080646,10.390180644032256,0.0],[11.847759065022574,10.76536686473018,0.0],[11.66293922460509,11.111140466039204,0.0],[11.414213562373096,11.414213562373096,0.0],[11.111140466039204,11.66293922460509,0.0],[10.76536686473018,11.847759065022574,0.0],[10.390180644032256,11.96157056080646,0.0],[10.0,12.0,0.0],[9.609819355967744,11.96157056080646,0.0],[9.23463313526982,11.847759065022574,0.0],[8.888859533960796,11.66293922460509,0.0],[8.585786437626904,11.414213562373096,0.0],[8.33706077539491,11.111140466039204,0.0],[8.152240934977426,10.76536686473018,0.0],[8.03842943919354,10.390180644032258,0.0],[8.0,10.0,0.0],[8.03842943919354,9.609819355967744,0.0],[8.152240934977426,9.23463313526982,0.0],[8.337060775394908,8.888859533960796,0.0],[8.585786437626904,8.585786437626904,0.0],[8.888859533960796,8.33706077539491,0.0],[9.234633135269819,8.152240934977428,0.0],[9.609819355967742,8.03842943919354,0.0],[10.0,8.0,0.0],[10.390180644032256,8.03842943919354,0.0],[10.76536686473018,8.152240934977426,0.0],[11.111140466039204,8.337060775394908,0.0],[11.414213562373094,8.585786437626904,0.0],[11.66293922460509,8.888859533960796,0.0],[11.847759065022572,9.234633135269819,0.0],[11.96157056080646,9.609819355967742,0.0]],"start_vertex":null}],"regions":[4,7]},{"boundaries":[{"closed":true,"dihedral_deg":45.0,"end_vertex":null,"kind":"transversal","points":[[13.923141121612922,9.219638711935485,8.0],[13.695518130045146,8.469266270539638,8.0],[13.325878449210181,7.777719067921591,8.0],[12.82842712474619,7.171572875253809,8.0],[12.222280932078407,6.674121550789819,8.0],[11.53073372946036,6.304481869954854,8.0],[10.780361288064514,6.076858878387078,8.0],[10.0,6.0,8.0],[9.219638711935485,6.076858878387078,8.0],[8.469266270539638,6.304481869954854,8.0],[7.777719067921591,6.674121550789819,8.0],[7.171572875253809,7.17157287525381,8.0],[6.674121550789819,7.777719067921592,8.0],[6.304481869954852,8.469266270539642,8.0],[6.076858878387078,9.219638711935486,8.0],[6.0,10.0,8.0],[6.076858878387078,10.780361288064514,8.0],[6.304481869954853,11.53073372946036,8.0],[6.674121550789819,12.222280932078409,8.0],[7.17157287525381,12.82842712474619,8.0],[7.777719067921592,13.325878449210181,8.0],[8.469266270539642,13.695518130045148,8.0],[9.219638711935488,13.923141121612922,8.0],[10.0,14.0,8.0],[10.780361288064514,13.923141121612922,8.0],[11.530733729460358,13.695518130045148,8.0],[12.222280932078409,13.325878449210181,8.0],[12.82842712474619,12.82842712474619,8.0],[13.325878449210181,12.222280932078409,8.0],[13.695518130045148,11.530733729460358,8.0],[13.923141121612922,10.780361288064514,8.0],[14.0,10.0,8.0]],"start_vertex":null}],"regions":[5,6]},{"boundaries":[{"closed":true,"dihedral_deg":45.0,"end_vertex":null,"kind":"transversal","points":[[11.96157056080646,9.609819355967742,6.0],[11.847759065022572,9.234633135269819,6.0],[11.66293922460509,8.888859533960796,6.0],[11.414213562373094,8.585786437626904,6.0],[11.111140466039204,8.337060775394908,6.0],[10.76536686473018,8.152240934977426,6.0],[10.390180644032256,8.03842943919354,6.0],[10.0,8.0,6.0],[9.609819355967742,8.03842943919354,6.0],[9.234633135269819,8.152240934977428,6.0],[8.888859533960796,8.33706077539491,6.0],[8.585786437626904,8.585786437626904,6.0],[8.337060775394908,8.888859533960796,6.0],[8.152240934977426,9.23463313526982,6.0],[8.03842943919354,9.609819355967744,6.0],[8.0,10.0,6.0],[8.03842943919354,10.390180644032258,6.0],[8.152240934977426,10.76536686473018,6.0],[8.33706077539491,11.111140466039204,6.0],[8.585786437626904,11.414213562373096,6.0],[8.888859533960796,11.66293922460509,6.0],[9.23463313526982,11.847759065022574,6.0],[9.609819355967744,11.96157056080646,6.0],[10.0,12.0,6.0],[10.390180644032256,11.96157056080646,6.0],[10.76536686473018,11.847759065022574,6.0],[11.111140466039204,11.66293922460509,6.0],[11.414213562373096,11.414213562373096,6.0],[11.66293922460509,11.111140466039204,6.0],[11.847759065022574,10.76536686473018,6.0],[11.96157056080646,10.390180644032256,6.0],[12.0,10.0,6.0]],"start_vertex":null}],"regions":[6,7]}],"ir_version":0,"regions":[{"id":0,"residual":{"max":0.00006,"rms":0.00002},"surface":{"normal":[-1.0,0.0,0.0],"origin":[0.0,0.0,0.0],"type":"plane"},"triangles":[0,1]},{"id":1,"residual":{"max":0.00006,"rms":0.00002},"surface":{"normal":[1.0,0.0,0.0],"origin":[20.0,0.0,0.0],"type":"plane"},"triangles":[2,3]},{"id":2,"residual":{"max":0.00006,"rms":0.00002},"surface":{"normal":[0.0,-1.0,0.0],"origin":[0.0,0.0,0.0],"type":"plane"},"triangles":[4,5]},{"id":3,"residual":{"max":0.00006,"rms":0.00002},"surface":{"normal":[0.0,1.0,0.0],"origin":[0.0,20.0,0.0],"type":"plane"},"triangles":[6,7]},{"id":4,"residual":{"max":0.00006,"rms":0.00002},"surface":{"normal":[0.0,0.0,-1.0],"origin":[0.0,0.0,0.0],"type":"plane"},"triangles":[8,9]},{"id":5,"residual":{"max":0.00006,"rms":0.00002},"surface":{"normal":[0.0,0.0,1.0],"origin":[0.0,0.0,8.0],"type":"plane"},"triangles":[10,11]},{"id":6,"residual":{"max":0.00006,"rms":0.00002},"surface":{"apex":[10.0,10.0,4.0],"axis":[0.0,0.0,1.0],"half_angle":0.7853981633974483,"orientation":"reversed","type":"cone"},"triangles":[12,13,14,15,16,17,18,19,20,21,22,23,24,25,26,27]},{"id":7,"residual":{"max":0.00006,"rms":0.00002},"surface":{"axis":[0.0,0.0,1.0],"orientation":"reversed","origin":[10.0,10.0,0.0],"radius":2.0,"type":"cylinder"},"triangles":[28,29,30,31,32,33,34,35,36,37,38,39,40,41,42,43]}],"shells":[{"closed":true,"parent":null,"regions":[0,1,2,3,4,5,6,7],"role":"outer"}],"source":{"triangle_count":44,"vertex_count":24},"tolerances":{"angular_snap_deg":0.5,"linear":0.001,"tangent_threshold_deg":3.0,"vertex_merge":1e-6},"vertices":[{"id":0,"position":[0.0,0.0,0.0],"regions":[0,2,4],"role":"junction","source_positions":[[0.0,0.0,0.0]]},{"id":1,"position":[0.0,0.0,8.0],"regions":[0,2,5],"role":"junction","source_positions":[[0.0,0.0,8.0]]},{"id":2,"position":[0.0,20.0,0.0],"regions":[0,3,4],"role":"junction","source_positions":[[0.0,20.0,0.0]]},{"id":3,"position":[0.0,20.0,8.0],"regions":[0,3,5],"role":"junction","source_positions":[[0.0,20.0,8.0]]},{"id":4,"position":[20.0,0.0,0.0],"regions":[1,2,4],"role":"junction","source_positions":[[20.0,0.0,0.0]]},{"id":5,"position":[20.0,0.0,8.0],"regions":[1,2,5],"role":"junction","source_positions":[[20.0,0.0,8.0]]},{"id":6,"position":[20.0,20.0,0.0],"regions":[1,3,4],"role":"junction","source_positions":[[20.0,20.0,0.0]]},{"id":7,"position":[20.0,20.0,8.0],"regions":[1,3,5],"role":"junction","source_positions":[[20.0,20.0,8.0]]}]}
